{
  "analyzer_version": "incremental-contracts-v1",
  "configuration": {},
  "entries": {
    "__init__.py": {
      "analyzed": [],
      "changed": [],
      "function_keys": [],
      "granularity": "function",
      "indexed_source_sha256": "5a6ef170f7fb4e524e9b4e887191e395b8573ac56fcd1e8857b30ba65bd757e0",
      "invalidated": [],
      "language": "python",
      "parser": {
        "adapter": "tree-sitter",
        "declared_version": "tree-sitter-python>=0.25,<0.26; stdlib fallback",
        "implementation": "tree-sitter-or-stdlib",
        "installed_versions": {},
        "language": "python",
        "python": "3.12.12",
        "unavailable_distributions": [
          "tree-sitter",
          "tree-sitter-python"
        ],
        "used": "unavailable"
      },
      "path": "__init__.py",
      "removed": [],
      "reused": [],
      "source_sha256": "5a6ef170f7fb4e524e9b4e887191e395b8573ac56fcd1e8857b30ba65bd757e0",
      "stale": false,
      "status": "ok",
      "unknowns": []
    },
    "contracts.py": {
      "analyzed": [
        "contracts.py::_observable_behavior",
        "contracts.py::as_legacy_pairs",
        "contracts.py::canonicalize",
        "contracts.py::subsume"
      ],
      "changed": [
        "contracts.py::_observable_behavior",
        "contracts.py::as_legacy_pairs",
        "contracts.py::canonicalize",
        "contracts.py::subsume"
      ],
      "function_keys": [
        "contracts.py::_observable_behavior",
        "contracts.py::as_legacy_pairs",
        "contracts.py::canonicalize",
        "contracts.py::subsume"
      ],
      "granularity": "function",
      "indexed_source_sha256": "ef84ccafb0f9f7f9d362374beefb1222e16b711d1cfac0a28db6a7adc4554f87",
      "invalidated": [
        "contracts.py::_observable_behavior",
        "contracts.py::as_legacy_pairs",
        "contracts.py::canonicalize",
        "contracts.py::subsume"
      ],
      "language": "python",
      "parser": {
        "adapter": "tree-sitter",
        "declared_version": "tree-sitter-python>=0.25,<0.26; stdlib fallback",
        "implementation": "tree-sitter-or-stdlib",
        "installed_versions": {},
        "language": "python",
        "python": "3.12.12",
        "unavailable_distributions": [
          "tree-sitter",
          "tree-sitter-python"
        ],
        "used": "unavailable"
      },
      "path": "contracts.py",
      "removed": [],
      "reused": [],
      "source_sha256": "ef84ccafb0f9f7f9d362374beefb1222e16b711d1cfac0a28db6a7adc4554f87",
      "stale": false,
      "status": "unknown",
      "unknowns": [
        "IndexError: list index out of range"
      ]
    },
    "engine.py": {
      "analyzed": [
        "engine.py::CoreEngine._node_count",
        "engine.py::CoreEngine._node_dict",
        "engine.py::CoreEngine.audit",
        "engine.py::CoreEngine.call_graph",
        "engine.py::CoreEngine.capabilities",
        "engine.py::CoreEngine.contracts_file",
        "engine.py::CoreEngine.execute",
        "engine.py::CoreEngine.extract_contracts",
        "engine.py::CoreEngine.language",
        "engine.py::CoreEngine.operations",
        "engine.py::CoreEngine.parse",
        "engine.py::CoreEngine.soundness",
        "engine.py::CoreEngine.verify_patch",
        "engine.py::get_engine"
      ],
      "changed": [
        "engine.py::CoreEngine._node_count",
        "engine.py::CoreEngine._node_dict",
        "engine.py::CoreEngine.audit",
        "engine.py::CoreEngine.call_graph",
        "engine.py::CoreEngine.capabilities",
        "engine.py::CoreEngine.contracts_file",
        "engine.py::CoreEngine.execute",
        "engine.py::CoreEngine.extract_contracts",
        "engine.py::CoreEngine.language",
        "engine.py::CoreEngine.operations",
        "engine.py::CoreEngine.parse",
        "engine.py::CoreEngine.soundness",
        "engine.py::CoreEngine.verify_patch",
        "engine.py::get_engine"
      ],
      "function_keys": [
        "contracts.py::_observable_behavior",
        "contracts.py::as_legacy_pairs",
        "contracts.py::canonicalize",
        "contracts.py::subsume",
        "engine.py::CoreEngine._node_count",
        "engine.py::CoreEngine._node_dict",
        "engine.py::CoreEngine.audit",
        "engine.py::CoreEngine.call_graph",
        "engine.py::CoreEngine.capabilities",
        "engine.py::CoreEngine.contracts_file",
        "engine.py::CoreEngine.execute",
        "engine.py::CoreEngine.extract_contracts",
        "engine.py::CoreEngine.language",
        "engine.py::CoreEngine.operations",
        "engine.py::CoreEngine.parse",
        "engine.py::CoreEngine.soundness",
        "engine.py::CoreEngine.verify_patch",
        "engine.py::get_engine"
      ],
      "granularity": "module",
      "indexed_source_sha256": "029b3a99235cb07868624b417169833b8b60d0e58c622d9b0c2088d4a7f0dcb0",
      "invalidated": [
        "engine.py::CoreEngine._node_count",
        "engine.py::CoreEngine._node_dict",
        "engine.py::CoreEngine.audit",
        "engine.py::CoreEngine.call_graph",
        "engine.py::CoreEngine.capabilities",
        "engine.py::CoreEngine.contracts_file",
        "engine.py::CoreEngine.execute",
        "engine.py::CoreEngine.extract_contracts",
        "engine.py::CoreEngine.language",
        "engine.py::CoreEngine.operations",
        "engine.py::CoreEngine.parse",
        "engine.py::CoreEngine.soundness",
        "engine.py::CoreEngine.verify_patch",
        "engine.py::get_engine"
      ],
      "language": "python",
      "parser": {
        "adapter": "tree-sitter",
        "declared_version": "tree-sitter-python>=0.25,<0.26; stdlib fallback",
        "implementation": "tree-sitter-or-stdlib",
        "installed_versions": {},
        "language": "python",
        "python": "3.12.12",
        "unavailable_distributions": [
          "tree-sitter",
          "tree-sitter-python"
        ],
        "used": "unavailable"
      },
      "path": "engine.py",
      "removed": [],
      "reused": [
        "contracts.py::_observable_behavior",
        "contracts.py::as_legacy_pairs",
        "contracts.py::canonicalize",
        "contracts.py::subsume"
      ],
      "source_sha256": "029b3a99235cb07868624b417169833b8b60d0e58c622d9b0c2088d4a7f0dcb0",
      "stale": false,
      "status": "unknown",
      "unknowns": [
        "IndexError: list index out of range",
        "ValueError: no top-level function '_node_count' found",
        "ValueError: no top-level function '_node_dict' found",
        "ValueError: no top-level function 'audit' found",
        "ValueError: no top-level function 'call_graph' found",
        "ValueError: no top-level function 'capabilities' found",
        "ValueError: no top-level function 'contracts_file' found",
        "AnalysisTimeout: engine.py: analysis exceeded 1000ms",
        "AnalysisTimeout: engine.py: analysis exceeded 1000ms",
        "AnalysisTimeout: engine.py: analysis exceeded 1000ms",
        "AnalysisTimeout: engine.py: analysis exceeded 1000ms",
        "AnalysisTimeout: engine.py: analysis exceeded 1000ms",
        "AnalysisTimeout: engine.py: analysis exceeded 1000ms",
        "AnalysisTimeout: engine.py: analysis exceeded 1000ms",
        "AnalysisTimeout: engine.py: analysis exceeded 1000ms"
      ]
    },
    "models.py": {
      "analyzed": [
        "contracts.py::canonicalize",
        "contracts.py::subsume",
        "engine.py::CoreEngine.contracts_file",
        "engine.py::CoreEngine.extract_contracts",
        "models.py::OperationResult.to_dict",
        "models.py::PathContract.create",
        "models.py::PathContract.identity",
        "models.py::PathContract.to_dict",
        "models.py::SourceDocument.__post_init__",
        "models.py::SourceDocument.from_path",
        "models.py::SourceDocument.line",
        "models.py::SourceDocument.slice",
        "models.py::SourceDocument.to_dict",
        "models.py::canonical_json",
        "models.py::contracts_from_pairs",
        "models.py::sha256_json"
      ],
      "changed": [
        "models.py::OperationResult.to_dict",
        "models.py::PathContract.create",
        "models.py::PathContract.identity",
        "models.py::PathContract.to_dict",
        "models.py::SourceDocument.__post_init__",
        "models.py::SourceDocument.from_path",
        "models.py::SourceDocument.line",
        "models.py::SourceDocument.slice",
        "models.py::SourceDocument.to_dict",
        "models.py::canonical_json",
        "models.py::contracts_from_pairs",
        "models.py::sha256_json"
      ],
      "function_keys": [
        "contracts.py::_observable_behavior",
        "contracts.py::as_legacy_pairs",
        "contracts.py::canonicalize",
        "contracts.py::subsume",
        "engine.py::CoreEngine._node_count",
        "engine.py::CoreEngine._node_dict",
        "engine.py::CoreEngine.audit",
        "engine.py::CoreEngine.call_graph",
        "engine.py::CoreEngine.capabilities",
        "engine.py::CoreEngine.contracts_file",
        "engine.py::CoreEngine.execute",
        "engine.py::CoreEngine.extract_contracts",
        "engine.py::CoreEngine.language",
        "engine.py::CoreEngine.operations",
        "engine.py::CoreEngine.parse",
        "engine.py::CoreEngine.soundness",
        "engine.py::CoreEngine.verify_patch",
        "engine.py::get_engine",
        "models.py::OperationResult.to_dict",
        "models.py::PathContract.create",
        "models.py::PathContract.identity",
        "models.py::PathContract.to_dict",
        "models.py::SourceDocument.__post_init__",
        "models.py::SourceDocument.from_path",
        "models.py::SourceDocument.line",
        "models.py::SourceDocument.slice",
        "models.py::SourceDocument.to_dict",
        "models.py::canonical_json",
        "models.py::contracts_from_pairs",
        "models.py::sha256_json"
      ],
      "granularity": "module",